{"schema_version":"1.0.0","case_id":"case-demo-20260927","network":"bitcoin-regtest","txid":"1111111111111111111111111111111111111111111111111111111111111111","vin":0,"prev_txid":"2222222222222222222222222222222222222222222222222222222222222222","prev_vout":1,"address":"bcrt1qsourceprovidedinput","amount_sats":130000,"sequence":4294967293,"source_refs":[{"evidence_id":"ev-demo-transactions","source_sha256":"0000000000000000000000000000000000000000000000000000000000000000","locator_type":"synthetic","locator":"input:0","byte_start":null,"byte_end":null}]}
